{
  "key": "1_1",
  "kind": "fetch_ayah",
  "note": "INTERNAL evidence only — redacted example; never shipped",
  "public_export_allowed": false,
  "request": {
    "ayah": 1,
    "include": [
      "irab",
      "gharib"
    ],
    "surah": 1
  },
  "response": {
    "_display": "اعرض هذا النص حرفياً وكاملاً بين علامتي اقتباس مع ذكر النسبة (attribution): (١) انسخ كل حرف كما ورد — بما فيه ترويسة المؤلف في مطلع السورة (مثل «تفسير سورة الناس وهي مدنية») والبسملة، وعلامات الهوامش مثل {[1]} و{[2]}، وجهاز النقد ¬...¥ (فرو …[trimmed]",
    "ayah": 1,
    "gharib": "﴿ بِسۡمِ ٱللَّهِ ﴾: أبتدِئُ القراءةَ مُسْتعيناً باللهِ.\n﴿ ٱلرَّحۡمَٰنِ ﴾: ذي الرَّحمةِ العامَّةِ لجميع الخَلْقِ.\n﴿ ٱلرَّحِيمِ ﴾: ذي الرَّحمةِ الخاصَّةِ بِالمؤمنين.",
    "irab": "{بِسْمِ اللَّهِ الرَّحْمَنِ الرَّحِيمِ (1)}\nبِسْمِ: الباء حرف جرّ مبنيّ على الكسر.\nاسم: اسم مجرور وعلامة جرّه الكسرة. والجارّ والمجرور متعلّقان بفعل محذوف تقديره: أبدأ، أو متعلّقان بخبر مبتدأ محذوف، والتقدير: بدئي باسم الله، واسم مضاف.\nالله …[trimmed]",
    "surah": 1,
    "tajweed": null,
    "text": "بسم الله الرحمن الرحيم",
    "text_simple": "بسم الله الرحمن الرحيم",
    "text_uthmani": "بسم الله الرحمن الرحيم",
    "word_count": 4
  },
  "schema": "fusha/tafsir-mcp-cache@1",
  "source": {
    "endpoint": "https://mcp.tafsir.net/mcp",
    "name": "Tafsir MCP",
    "version": "1.27.1"
  },
  "source_hash": "91ff5b5af6f7b2df"
}
